tweet_id,safe_text,label,agreement
EW36A1KU, i used mmr for a few months but went back to  after getting a better phone gps uses up battery in general though,0.0,1.0
ZYPAMCOX,initial outbreak of measles was at disneyland,0.0,1.0
VA5M16DO, that would make her a liar i believe and if u think shes not getting some form of immunity i got land  sale truthright,0.0,1.0
I7EREYA8,childhood immunization rates atst steps practices up  over months great news from the harvest conference ,1.0,1.0
JHBY3LG3,king county health officials warn of possible measles exposure king county health officials say a child with ,0.0,1.0
388E7E9I,catios 😂 mmr,0.0,1.0
Y6PEXP67,study of more than  kids finds no link between mmr vaccine and autism ,1.0,0.6666666666666666
26YYN5DT,vaccines vaccines galore  beaver health mart in beaver pa ,1.0,0.6666666666666666
NITP69Z0, thought ud find this interesting as a flu shot enthusiastchattanooga man paralyzed after getting flu vaccin ,-1.0,1.0
0DCTR0U9,quot rt  cdc recommends hpv vaccination for boys  cancerquot,1.0,1.0
UWJZP72D,hb update providing for hospital care or assistance necessitated by traumatic injury immunity ,0.0,0.6666666666666666
RE6C4TTL,worried you’ve been exposed to the measles ,0.0,1.0
M3AOW4Y4,“ on average people who complain live longer  releasing this tension increases immunity and boosts their health”,0.0,1.0
KBS22V6Q,vaccinate your damn kids or dont fucking have them period,1.0,1.0
NNVWYV7C,travel jobs travel immunization nurse specialist  passport health travel medicine   philadelphia pa  ,0.0,0.6666666666666666
UZUPT0RZ, take emergen c when you start feeling sick works wonders and i even am around sick kids everyday immunityboost,0.0,1.0
VTJ7SNQ1,measles outbreak growing at least people in states infected    ,0.0,0.6666666666666666
UT1OZXFW, the belief that vaccinations cause autism or brain damage is wrong and dangerous ,1.0,1.0
V0FU7U9T,only souvenir from fl bug bites i look like i have measles time to hit the tea tree oil,0.0,1.0
ISZ1P17F,vaccinations inject or reject issue forum at multnomah county building they have proven themselves to be safe  pdxcityclub,1.0,0.6666666666666666
59FMV4QJ,muppets marvel star wars now measles disney owns everything,0.0,1.0
9FZUI8ZI,measles in framingham another reason why i hate this place,0.0,1.0
8XUBKOK8,geof leading the cheers circa ucla  usuck troy  aikman vs rodney peete measles thank you geof… ,0.0,1.0
E0VDEYR1,  i have a friend that home schools and doesnt vaccinate but not sure they would share their story,0.0,0.6666666666666666
0S6Z7F61,health officials warn san francisco bartriders of measles exposure ,0.0,1.0
VVTIXKKG,hey get your kids vaccinated so those who dont have strong immune systems because of medications dont have to suffer thanks,1.0,1.0
D85ALY09,my brother  came  chill wit the kid mmr popularnobodies  the key club ,0.0,1.0
0XVFX2F8,i think facing a mandatory quarantine from school if exposed and not vaccinated would change some minds weirdede,1.0,1.0
8NV9NKQN,  i think if dont vaccinate ur kidthats fine if ur kid gets sick cuz of it we just have to put them down,1.0,1.0
9N46OULD,marin vaccine skipping raises concerns of polio resurgence the measles outbreak originating in disneyland brought… ,1.0,0.6666666666666666
841RU7GL,h enroll immunity from liability for providing free health care services ,0.0,1.0
WN73MQPZ,   injuries amp death from hpv vaccine heres article out of many from a simple google search ,-1.0,1.0
X1XMNAZ4, yoga teachers dont make enough money to not believe in vaccinating kids wifes a yoga teacher and kid is fully vaxed,1.0,0.6666666666666666
0R6SCQ5X,im a busy bee getting my mmr titers drawn  labcorp in henderson nv ,0.0,0.6666666666666666
ELKJCHAK,"epic convo 
ahh hes harmless
if youre vaccinated",1.0,0.6666666666666666
AZFPWYPF,so i dont have to get another mmr vaccine we all get them shit when were little wtf,0.0,1.0
YSIB1L9A, i knowi guess i have to build up an immunity to kid germs,0.0,1.0
FRMIAH2T,i need to go to disneyland before my pass expires this week but my grandma doesnt want us to go bc of the measles outbreak 😣,0.0,1.0
OYEXZBRI,vaccination debate nhc experts encourage parents to immunize kids ,1.0,0.6666666666666666
H7TIVDCV,oh yeahparents should be free to not vaccinate but women cannot make decisions about reproduction and health whenwillitend,0.0,0.6666666666666666
2W4ML17D, tells advocacyhealth gavi is one of greatest global health stories cut vaccine cost by  ,0.0,1.0
K225HPSE,cdc has changed recommendation for getting infants vaccinated against measles my report next on fox or watch on ,0.0,0.6666666666666666
UXY6DZ2I,infant in georgia diagnosed with measles  california atlanta ,0.0,1.0
SD1W8P09,  has anyone connected measles with an ongoing flood at our southern border cluelesspotus,0.0,1.0
UXZ0499M,“ of californias  measles cases intentionally unvaccinated ,1.0,0.6666666666666666
A2RXUT0L,baltimore has been lucky to avoid measles health commissioner says there hasnt been a confirmed measles case… ,0.0,1.0
EXBMA5N2,why its important swfl families protect their families from the measles virusive got the answer coming up in ten minutes ,0.0,1.0
A0ITIBYG,people who dont vaccinate their kids because they believe in dumb conspiracy theories that have been proven to be untrue piss me off,1.0,1.0
RY38P9RW,i hate that i learned this on fox news  but i did my doctor can check to see if im still immune to measles    ,0.0,1.0
R1UXO7LA,in pakistan vaccinating children has become a deadly battle while vaccine distrust has sparked debates amid a… ,0.0,1.0
0LNN33KA,two things vaccines were made for a reason amp death row inmates are there for a reason if they suffer in their last moments so what,1.0,0.6666666666666666
YJSTLJX4,love me some mmr,0.0,0.6666666666666666
MIPDWY5Y, absolutely it only takes a vaccine but parents today are more ignorant than forty years ago and put others at risk,1.0,1.0
JHYQGFIV,instead of focusing on a healthy diet to improve the immune system just take our vaccines so we can make money off of you  the cdc,-1.0,1.0
Q46DPV34,jeffkoonsstudio and simondepury selling hermes readymades to fight measles  the four seasons restaurant ,0.0,1.0
UUJN5FN5, a child can have a lethal reaction to a vaccine this was bachmann at her human best,-1.0,1.0
NVMLNM96,you know youre a s kid when your vaccinations were mandatory to be in school and no one brought home measles,1.0,0.6666666666666666
HIXUTWPP,my bf from high school wont mmr vax her kids and i love to rank on her so i bought her a lovely shirt for her bday ,1.0,0.6666666666666666
SLLZP3GF,  she has this rare disease so they kicked her out of school and made her go to the doctor to get a vaccine,0.0,1.0
PKH5INX4, a disease with a  mortality rate with no treatments or vaccine that isnt in the us yetuntil now its destroying africa,-1.0,0.3333333333333333
9QGQM10J,baltimore health officials urge parents to vaccinate kids pediatricians from baltimorearea hospitals and the… ,1.0,1.0
SFDIUBMX,do you know the truth about the connection between vaccines and autism hint science knows via  ,-1.0,0.6666666666666666
X94UGLYI,“ womans cancer wiped out by giant dose of measles virus  rt    amazing,-1.0,0.3333333333333333
NG41YFG4,  then keep your babies in your house and stay away from us you risk giving us polio measles and whooping cough,0.0,1.0
VTRN0SXP, knowing hpv exists is one thing what to do about its another really push children to get hpv vaccine so this test neg,1.0,0.6666666666666666
ZSDFYLPJ, this how parents handled mumps where there was no better option now its just plain stupid measles can be dead serious,1.0,0.6666666666666666
ON5S11AK,why isnt the news talking about how measles were wiped out and then came back cuz dumbass ppl dont vaccinate their kids,1.0,0.6666666666666666
Y5DYKI0W," unless jenny mccarthy writes a book entitled im sorry i helped spread whooping 
cough and measles  is better",1.0,1.0
IMK2ZTG9,flu vaccine prevented  million illnesses last season cdc ,1.0,0.6666666666666666
IKDN50M5,why you should vaccinate your kids via ,1.0,1.0
S0V7GT6P,i had measles when i was  it didnt make morning news,0.0,1.0
SUL5U640, thank you for this timely post  good info in light of the measles outbreak,0.0,0.6666666666666666
KQGB9LP1,via  immune amnesiascientists crack a yearold mystery about the measles vaccine ,0.0,0.6666666666666666
EB86B94E,hmmmm measles outbreakim sure they checked all those illegals crossing the border to make sure they had their shots,1.0,0.6666666666666666
CHO1BNH0,mumps amp measles in idaho in ,0.0,1.0
DJXR75H7,whats with all these hockey players getting mumps arent we supposed to get vaccines as a child to counteract getting those mmrshots,1.0,0.6666666666666666
AUCDLGYK, gt mn dept of education releases mmr results annually often gets the local conversation going on how to make improvements,0.0,1.0
5UBE3XOU,the fact that people are choosing not to vaccinate their children angers me to no end,1.0,1.0
KLYAH9P0,disney measles outbreak resort asks staff for proof theyre protected ,0.0,0.6666666666666666
FQ60U4JM,"“nationalism is an infantile disease it is the measles of mankind”

☯ albert einstein",0.0,1.0
N530BVW8,disneylinked measles outbreak soon to be over in california a measles outbreak that began at disneyland and… ,0.0,1.0
9KFVM69G,sum vaccines like  n flu have chemicals in them that n would ever want in their bodyyet the cdc approves themy slowly but surely ,-1.0,1.0
EG27FCEE,icymi british journal retracts paper linking autism and vaccines ,0.0,0.6666666666666666
PLK4SBVL, even say if a vaccine affects kids its better than having a major disease like polio or measles prominent again,1.0,1.0
YSMNQACP,good advice for parents who are concerned about their infants and the current measles situation ,1.0,0.6666666666666666
5S9QXBJ2,health news the vaccine for cervical cancer may also help men read how ,1.0,0.6666666666666666
2Z18XKQW,a cnn commentator just said there is a measles case at baird college bet people at bard are thrilled with this,0.0,1.0
XMX51M88,cdc measles tally doubled in the past month new york ap — measles outbreaks seem to be accelerating and in ,0.0,0.6666666666666666
FTKXP8Z6,spoke this am san marco rotary club  gift was donation in rethreadeds name allowing  kids to get polio vaccines ,1.0,1.0
4UG3NAO9,skl based health centers help meet immunizations sport medicals and save money from less hospitalizations,0.0,0.6666666666666666
6YWL3A0H,you dont even know whats in the vaccines how can you argue the fact  diseases in men and women are rising and rising,-1.0,1.0
KYQM9TJY, should the measles vaccine be mandatory 😭 i got all the stuff i just dont wanna write it,0.0,0.6666666666666666
245MGZAO,third mmr dose welltolerated during mumps outbreak medscape  universityvillage newyork ny,0.0,1.0
KS0JH2WZ, im usually immune to it but stress is killing that immunity lol,0.0,1.0
F09NBFID,enterovirus no vaccine for it affecting children across us  pernicious and subtle parents monitor your children,0.0,0.6666666666666666
UGGTSDZT,measles at csulb okay great,0.0,1.0
YGRDQ4LJ,earlier w therealsqueeze amp  militantminded rrr mmr srmg yo rrrdbd what up we here … ,0.0,1.0
4L2AQAHT,berkeley city council to send letter of support for vaccination exemption bill berkeley city council will send a… ,0.0,0.6666666666666666
99OB3GZ3,“ health dept warns super bowl visitors may have been exposed to measles  yikes,0.0,1.0
PQ2UCYTR,ya ready con  pala caravana de houstontexas saludos a too tura y un gran abrazo mmr and mbc   ted,0.0,1.0
4E61PQI7,prayer is the immunity system of the body of christthru prayer we fight off invasive forces amp diseases that afflict the body of christ,-1.0,0.6666666666666666
AL4LINZ5,whats more stupid isil talking about islam or republican presidential candidates talking about measles,0.0,1.0
KSS3YNGL,getting blood test to prove i have measles immunity geez  urmc medical labs in rochester ny ,0.0,0.6666666666666666
WZH0MXGD, makes no tear drops allergic to vaccines just very mean but hes my baby,0.0,1.0
C3J9Q6BB,chicagoarea measles cases put spotlight on day care centers ,0.0,1.0
PPPCJ9DK,a baby was born on the j train this morning can we safely assume that it has immunity to all diseases that affect humans and rats,-1.0,0.3333333333333333
XQ4W0ZYT,rt thanks for bringing measles back antivaccine people ,1.0,1.0
QUMNKX1C,new vaccine helping brain cancer patients first coast news  weston fl,1.0,0.6666666666666666
NZPBGADS,i think its absolutely absurd people wont vaccinate their kids 😂,1.0,1.0
TK525OEI,loves like the measlesall the worse when it comes late in life,0.0,1.0
3X6JBU5K,reminder to vaccinate your fucking children thank you,1.0,1.0
OUEHB8OA,ny state advises nonimmune after train rider gets measles ,0.0,0.6666666666666666
BN6425H5,interesting editorial given the current measles outbreak in nyc ,1.0,1.0
STBEVEYW, unfortunately the national weather service forgot to issue a vaccinate your fucking kids alert the past years gtlt,1.0,1.0
FXKYVYRJ,🔥🔥🔥 my version of drakes god 🚨link in my bio🚨 jennifair mmr somage  somage studios ,0.0,1.0
EVKG0L37,ayomadhatterdc madhatter dcdj dc mmr mixmasterrod dopenessbro   mixmasterrods upstairs lounge ,0.0,1.0
BLSEWG0S,measles off to a fast start as cases trend up health officials are worried about recent us measles outbreaks ,0.0,1.0
UZ0GRKA0,another study finds no link between mmr vaccine and autism ,0.0,0.6666666666666666
ABYAS6TC,co ranks  in unvaccinated kids putting everyone at risk because of science that was proven to be faked almost a year ago vaccinateyourkid,1.0,1.0
HBNIKUNJ, babies die  sickened from bad vaccines in south mexico mexicos public health system has suspended infant… ,0.0,0.6666666666666666
2Q49ZLUK,measles is a child killer but for those who survive a common complication is deafness better primary healthcare will saveall our kids,0.0,0.6666666666666666
T06ALLF0,just got my last college vaccination i hope puigitis is on that list the guys a disease votefreddie,1.0,0.6666666666666666
4EEDH0NQ,with statistics like this i will never understand why people choose to not vaccinate their children 😤 ,1.0,1.0
G4D9LJIH,indexing chicago death records from  measles cholera diphtheria pneumonia especially kids  vaccineswork so do antibiotics,1.0,0.6666666666666666
IT3VWV5T,you look like you got the measles,0.0,0.6666666666666666
5KJ6SF8X,backtoschool fairs offer information immunizations parents are invited to attend three backtoschool fairs ,0.0,1.0
H0597FFU,last of the vaccinations for school getting shot up with tb and hep b  physicians east pa ,1.0,1.0
MLHFXSMG,im on the side the parents should decide on vaccinations for their kids the more power the government has the more totalitarian we become,0.0,0.6666666666666666
8YXBV43X, the parents own their children but they can be taken away by the state if parents are negligent like not vaccinating them,1.0,0.6666666666666666
9VQUL59U,talking about the mmr vaccine in class and all i can think of is leaguei have a problem,0.0,1.0
MKPXFR9X, think its been proven time amp time again that vaccination isnt the problem re autism spectrum,1.0,0.6666666666666666
3ZT821V4,bottom line is vaccinate your children guys 🙅,1.0,1.0
PZH55X07,at the nyc health department i gotta get these mmr shotsi hate needles im nervous af ,1.0,0.6666666666666666
L4WBL24C, i have mil now if anyonr is interested inbuying coins hmulegit mmr pro status player with lots of cred,0.0,1.0
OE9K3W6X, wake up america measles epid another attempt by the liberal media creating a story that is not there unvaccinated alien,-1.0,0.6666666666666666
B6U9OR69,“ measles proves delicate issue to gop field  but why  vaccinessavelives vaccineswork,1.0,0.6666666666666666
9NXSFL7M,“ oregon kids must be immunized by feb  or risk exclusion from school day care  ,1.0,0.6666666666666666
809Y6HUD,immunization requirements for  school year released the indiana state department of health has published ,0.0,1.0
1W4AH3GQ,this mmr gonna swallow you up it got worse as it went inside it we encountered corn thieves… ,0.0,0.6666666666666666
0DBRSHXP,city offers vaccine as number of meningitis cases grows the chicago health department now says a meningitis… ,1.0,0.6666666666666666
5SWIJ4BF,vaccinating schoolkids cuts flu in communities giving flu shots to schoolchildren also protects others a new… ,1.0,0.6666666666666666
834535E1,arguments for or against vaccinations in infants wish i could find more solid info,0.0,1.0
LAP1CN3G,"
i got flu shot too  but what about tdap  anyone planning to be around babies should get both these immunizations",1.0,1.0
ZZVTM2M0, an app that details immunizations requirements for countries you want to visit along with disease outbreak info,1.0,0.6666666666666666
SCTLGGH9,i hope they find a vaccine for this disease since hypopituitarism is becoming an epidemic diseases these days💔💔 ,1.0,0.6666666666666666
PW09DRPD, big red thinks it has game on the eagle but my two tone paint job gives them bitches measles,0.0,1.0
09GPK821,vaccinations are important rt  measles cases in california outbreak keep rising — now at almost  ,1.0,0.6666666666666666
ERE7QW6X, did you support your way to high mmr even in the calibration games,0.0,1.0
8DBRP38O, not at all  just a mom of  fully vaccinated children,1.0,1.0
S5H8TGVR,the mexican at work keeps calling my name and hugging me lmaoooooooooo im dead anyone have a hep c vaccination shot,0.0,0.6666666666666666
AL8LTCGB,uc to mandate vaccines for incoming students by  the university of california citing a widespread measles… ,0.0,0.6666666666666666
DVU562S3,important podcast with dr manoj jain on measles outbreak in memphis ,1.0,0.6666666666666666
WREFXFBN,   thank all the liberals  not immunizing their kids fear of unknown vs immunization  immunize ur kids,1.0,1.0
Y2XEFB6G,  yeah she get measles too theyre so tolerant,0.0,1.0
SQM4PW7D,long day of work and getting the babies vaccinated  spoiled w youd think chloe would be exhausted by now nope,1.0,0.6666666666666666
F6MJNX8A,senior pinning pictures tomorrow so naturally my face looks like i have measles their photoshop better be on point 👍,0.0,1.0
X5CQJYWC, pumpkin pie amd vaccinated kids are hard to find on the west coast,0.0,0.6666666666666666
QBPT1964,tarrant county student immunization information fort worth cbsdfwgtcom – school districts across north texas ,0.0,1.0
KH3UTD0X,     no has died of measles in usa since ,1.0,0.6666666666666666
N8419O3Z,got fucking infantago on my arm from my dads stupid ass cat that doesnt have any vaccines its basically a wild animal,1.0,0.6666666666666666
4BRFWOTX,elgin community college student among confirmed cases of measles elgin ill — an elgin community college student… ,0.0,1.0
H6A9WYZQ,jacob thinks he has the measles lol hes so mad at the world 😂,0.0,1.0
8P0T3F2F,everybody that went to elementary school got vaccinated i got polio shot along with  other vaccines when i was  it left scarstill have,-1.0,0.3333333333333333
O3285SPH,amazing doctor say measles virus put woman’s cancer in remission mayo clinic staff test to see if stacy ,0.0,0.6666666666666666
U068VWYW,🌕my parents say i was the perfect picture of health before i was vaccinated🐅,-1.0,1.0
12XW5P24,i dont deserve to be at this mmr im carrying sooooo much,0.0,0.6666666666666666
VTMR5X2I,vaccines never caused autism until someone said they did think about that,1.0,0.6666666666666666
4SZG10CO,resurgence of measles connected to decline of vaccinations vaccines are safe amp effective richard jove vgti tcpalmfuture,1.0,1.0
RG6I1M0Y,"msnbc you bastardsyou got me headline read beck sees measles outbreak as hoax

you click the link and it then changes to glenn beck",1.0,0.6666666666666666
GLCYSO8P,i hope  gets his measles vaccine before venturing into ohio,0.0,1.0
WXJWWEXU,“ unvaccinated person exposes thousands of commuters to measles   dang,1.0,0.6666666666666666
CF0R0NLT,omg they have a kaiser thing at work giving measles shots lmao,1.0,0.6666666666666666
DH8PVIEC,hahahaha “ chris christie parents should have some measure of choice on vaccinating their children ,1.0,0.6666666666666666
E1CYRA7O, is going down    attention mmr its going down,0.0,1.0
NJAMGRTV,health warning baby with measles traveled through portland airport  via ,0.0,1.0
DZ9OBQXM,cambridges takeda pharmaceutical co ltd is joining the campaign to develop a zika vaccine ,0.0,0.6666666666666666
GRLF2YMB, nationalism is an infantile disease the measles of humanityeinstein this is very true,0.0,1.0
IFBGV42A,blackbox very unlikely cause of  autism the immunization no longer contain mercury,1.0,1.0
LW13BERD,free backtoschool immunizations in irving and dallas ,1.0,0.6666666666666666
0CMWA0LK,rt  measles warning issued in connecticut ,0.0,1.0
LFL2M48M,recently found that smoking marijuana cause a mutation in mice leading to autism sorry jim carey its not vaccines science,1.0,1.0
VFEHHLWD,kids immunized by feb  or face exclusion from schooldaycare ,0.0,0.6666666666666666
U74T1008,microbiologist at state lab testing for measles  if testing ebola she would be in a level  lab w more protection ,0.0,1.0
CDGDGF8U,dont judge us its just metal love the hob  damageinc hobanaheim mmr madmusicreview  house of… ,0.0,1.0
O68YEGCT,does provide for the common defense include preventing measles and whooping cough notaconstitutionalscholar,0.0,0.6666666666666666
ZJ7OX2WI,"vaccinated student mmr photo credit shannon
usdhealthcomm  university of san diego ",1.0,1.0
LW6JHJ03,“ parents when should your child be vaccinated against hpv find out here  std prevention”,1.0,1.0
ZQMVIWCE,oakland mi has a reported case of measles so if your in mi and hate your kid to the point of not vaccinating heres your chance,1.0,1.0
9CBXI716,update boxer feinstein call for end to california’s vaccine exemptions ,0.0,0.6666666666666666
6HX5K3RE,measles outbreak to vaccinate or not vaccinate ,0.0,1.0
LB0ACYAV,im open to pretty much all opinions but if you dont vaccinate your kids youre utter scum,1.0,1.0
IE2N6ASJ,“ benefits of music  stress relief  boost immunity  reduce heart disease  enhances emotional strength  boost self esteem”,0.0,1.0
5IMDGIYS,number of tarrant county measles cases increases to health officials said monday nearly all of the measles ,0.0,1.0
EHTLOQVU,the goverment  finally admitted they new and continued giving out mmr shots and they caused autismthe shots should have been done sep,-1.0,1.0
7CG11DU1,fire at southwest and someone is getting carried out by the mmr from the science building great day at svsu,0.0,1.0
1NWYLY3B, no they dont you also want a list of all hiv pts how about a list of everyone who doesnt vaccinate their children,1.0,0.6666666666666666
B1V8IBOH,mmr booster for g return to target school valentines distributed and now home hoping the kid will nap bc mama wants to,1.0,0.6666666666666666
XPG3N8VW,guys dont vaccinate your kid but feel free to puff an ecig over their crib jenny macarthy,1.0,1.0
G3EIM78C,a much needed reality check pbs’ newest documentary will make you intelligently rethink vaccinations  autism,-1.0,0.3333333333333333
NCE5940C,i bet our culture and society do more to induce autism than what some people claim vaccines do,1.0,0.6666666666666666
L8G3Z08A, so mmr resets just reset to exploited when players rejoin  team all taken away achieves return heads up,0.0,1.0
1108S7FI, so does the fact that measles and such are appearing again due to vaccine hyperbole,0.0,0.6666666666666666
A4RJL3YE,california assembly passes strict school vaccination bill awaits gov brown signature california’s assembly has… ,0.0,1.0
I5IN61JX,another study proves no link between autism and vaccines having a child diagnosed with autism can be devastating ,1.0,1.0
QZNOE3OJ,  yep no measles yet but whooping cough was a thing also ,1.0,0.6666666666666666
CMUH9AVM, unfortunatly autoimmune disorders r increasing known allergies  vaccine ingredients recently correctd   ,0.0,1.0
LJ4TX7IG,   so you want be vaccinated and will risk your health and the health of yourself children and others,-1.0,0.6666666666666666
HZ1KH1DK,three babies ‘cured’ of hiv after being given vaccine after birth  via  ,0.0,0.6666666666666666
KX9X75BO,jennifair bizarre video paranoia consumes screen shot produced by drum mmr  ,0.0,1.0
DIP7UMJ1,vast majority on antivaccine people were vaccinated as children wonder how many fewer if they hadnt been measles polo etc victims,1.0,1.0
G48POW0W,should the state of california be quarantined because of measles epidemic might contain boxerpelosi feinstein amp an assortment of loonies,0.0,1.0
Q8ZL5T25,got my flu vaccine guess that means i should get ready for autism soon,1.0,1.0
F0HV4ZVL,need a vaccine   deaths so far from ebola in guinea  more in sierra leone  on alert ,1.0,1.0
3CLGX8ME,i wonder how many of these adults so against the truth of vaccine safety are fully vaxed hmmm cdcwhistleblower,1.0,0.6666666666666666
V2QCN0HR,     then they r told theyre crazy cuz vaccines r  perfectly safe,-1.0,0.6666666666666666
LKSSZADY,explorers gave native americans blankets deliberately infected with measles killing off  of the population with such biological weapon”,0.0,1.0
UJ9NOTGH,if i had cancer i would be willing to try anything even a massive dose of the measles thedoctors,0.0,1.0
9230B4LE, i hv a govt watchdog story u cdcwhistleblower admits mmr causes  inc in autism in boys x  black boys ,-1.0,1.0
VNDJNWOY,possible exposure to measles on the fourth at seatac airport an adoptee child who arrived from beijing on the ,0.0,1.0
Z3Y3WG7R,this gt rt  vaccinate your fucking children ,1.0,1.0
XJUNIZDY, sounds like measles or chicken pox,0.0,1.0
BMLVEHBO,ta goes off on reagan antivaccination nuts and the walking dead yells about being a honey badger and then ends class early,0.0,0.6666666666666666
