tweet_id,safe_text,label,agreement
69YG0WX2,  dont kid yourself it mutates  high rate no vaccine people are global mobile predict gtgtgt rapidly,-1.0,0.6666666666666666
QS29800C,  lies ✋ lol when dallas quit only jay and i were supposed to get immunity but drew paired you with us,0.0,1.0
BEU9QH1Y,damn illegals bringing all these diseases like measles scabies etc we were cured from all that and obama lets them come in damn just crazy,0.0,0.6666666666666666
RECRAC6P, yeah ive never gotten that or any immunizations besides when i was little for school,0.0,0.6666666666666666
18D293NJ,mmr bbq time,0.0,1.0
CF9YL5O0,protecting people from measles in guilford county ,0.0,1.0
K3FMB142,not doing the homeland homework being steps ahead buying vaccinations from open pharmaceutical in mexico like you can over the counter,1.0,0.6666666666666666
PF69X2R2, vaccines also prevent infectious diseases prove me wrong,1.0,1.0
UYWTAU1T,“     ” there hasnt been mercury in vaccines in more than years,1.0,1.0
OJB17IPW,  good luck im sure youll be one of those parents who refuse childhood vaccinations too,1.0,0.6666666666666666
2SE4MPDM,  agree irs most serious scandal no  immunity lerner who report irs targeting  had disputes n mths,0.0,1.0
S0LCQA4A, ill listen to you measles,0.0,1.0
XSXFN1C8, vaccines causing autism,-1.0,1.0
QFGTYCR2,california schools have been advised to close for friday the th  due to a measles outbreak your school is closed ,0.0,1.0
9MSFYU9I,by combined death from these causes declined by  percent b implementation of mass vaccine programs measles,1.0,0.6666666666666666
U9BW4OPE,congressman blasts cdc for incestuous relationship with vaccine makers  via ,0.0,1.0
9BNY2XWW,parents urged to get kids vaccinated for school now a nurse gives a girl a shot credit george freygetty ,1.0,1.0
3MSZF562, have you considered spreading measles to isis yet your welcome,0.0,0.6666666666666666
3WUHQ770,repeal immunity for drug companies against vaccine injuries  ,0.0,0.6666666666666666
QWNOQ25T,out here trying to be cute for ig pics with the thong showing and will fuck around and pussy have the measles,0.0,1.0
50VAUI9L,“ us measles cases rise over past week   great thanks antivaxxer,1.0,0.6666666666666666
W660EGW5,health officials warn of possible measles exposure in delaware and philadelphia counties the pennsylvania… ,0.0,1.0
LPZ1UQF8,will vaccines protect your kids from measles when it comes to protecting your kids from the measles outbreak… ,0.0,1.0
0EXGHYSA, are you against vaccines or against the autism speaks organization,0.0,0.6666666666666666
2UV8XDGK,also hiv has no vaccine safetytraining,0.0,1.0
RW7FTB1A,ebola ebola vaccines pass initial safety tests  new york times ,0.0,0.6666666666666666
ZHE0Y956,be a dragoncon superhero that fights deadly diseases like whooping cough flu and zombyism by going to marriott  for a free vaccine,1.0,1.0
3HKTRGDL,autism researcher wakefield cana t sue uk journal editor and reporter in texas andrew wakefield who was strip ,0.0,1.0
IIFGERHN,if i got the cold flu  black death stomach virus measlesmumps chicken pox then you got it to because you my gf we share errthang,0.0,1.0
KAV0TTIH,rt  on sttrip to africa w  she helped give polio vaccines  meds  giving those kids a shotatlife,0.0,0.6666666666666666
OU7BISJM,my mmr  is so shit its gonna take me like wins in a row to get to promo,0.0,1.0
XSPH8DS6,this place pays in beads blankets and measles morallybankrupt,0.0,0.6666666666666666
GQ4FXL1A,vaccine critics turn defensive over measles  via  vaccinessavelives ,1.0,1.0
8Z7ZV6V6, exactly id feel so bad if my kid killed another kid no vaccines but processed foods and led paint are cool haha,1.0,1.0
XVK17V03,aids   in children carry immunity to aids  study the study published in science translational medicine… ,0.0,1.0
XG97L9U2,  all were asking for is parentalrights vaccine exemption not be taken away please vetosb ,-1.0,0.6666666666666666
F9KHNCAG, measles health alert in california  due to unvaccinated child in riverside county,0.0,0.6666666666666666
HSWPR0XE,measles killing kids is the new freedom ,0.0,0.6666666666666666
PXIAUJAL,  that aint good u can get measles or some shit,0.0,1.0
040BWCKG,it is very selfish for a person not to get cold vaccinated i dont want any child thats not vaccinated b at playground thedoctors,1.0,1.0
ERSI1P72,“ mandatory vaccines are coming enjoy”nah aint about that,-1.0,0.3333333333333333
SHK2PHLD, some parents fear the chemicals used to bundle the vaccine into a shot cocktail will cause harm,-1.0,0.6666666666666666
IGE6VYMB,omg rt  parents have been arrested in pakistan for refusing their children’s polio vaccinations ,0.0,0.6666666666666666
3CC7WYOV,“ see you all next week for madmen se mmr”  👍,0.0,1.0
GT9DGJLY,facebook measles post goes viral a canadian mothers facebook post  speaking out against antivaccine activists… ,0.0,0.6666666666666666
829547HZ,old schoolseeing kids die of h flu disease new schoolvaccine preventable disease oldschool vaccineswork medicine improvements,1.0,1.0
M5T4ISF1,case closed internationalstudies on more than millionchildren have found no autismvaccine connection ,1.0,1.0
BBXLFXT7,polio is spreading in afghanistan pakistan and nigeria because some islamist groups believe vaccinations are a western conspiracy,1.0,1.0
FAQUVYVD,"almost  high school students who have not been immunized for measles are banned from classes today in palm desert
yes",1.0,0.6666666666666666
TYCGNGM3,this measles shit💩💩💩✔is  the birds✔✔✔ ✔,0.0,0.6666666666666666
SL52XRS9,kids in the hospital and dying cus you are uneducated and think vaccines cause autism ,1.0,0.6666666666666666
IU0TIJDI,living in a time where the sperm i used to waste on jenny mccarthy is doing better than some of the sperm that became kids vaccineswork,1.0,1.0
O41J71NR,  we all had to go through measles as children regular and german dont do it live clean,-1.0,0.3333333333333333
SH2894BV,san bernardino county lists sites of possible measles exposure nine cases of measles have been confirmed within… ,0.0,1.0
APEI238N,immunizations for school 😥👎💉,0.0,0.6666666666666666
0O2VK733,  too many children are getting sick amp some have died from vaccinesit defeats the purposetheres other  alternatives,-1.0,1.0
Y1YF88ZW,vaccines for my poor baby   kansas city department of health ,1.0,1.0
KEZEYWNA,kiddos appt immunizations physicals 💉😷,1.0,1.0
TFDD63ZC,should parents have right to know if child is exposed to unvaccinated classmates with the concern of measles on… ,0.0,0.6666666666666666
UVCQA54C,expert qampa childhood vaccine safety webmd health newsby kathleen dohenyreviewed by jennifer shu mdfor parents ,0.0,0.6666666666666666
BFIWIV7C,on average people who complain live longer  releasing this tension increases immunity and boosts their health” ,0.0,1.0
3NJEXM9H,buncombe parents are seven times more likely say no to kids’ vaccines for religious reasons  via ,-1.0,0.6666666666666666
AHYNHI2N,texas aampm will be home to  million vaccinemanufacturing facility the us department of health and human ,1.0,1.0
VDQ08N4Q,how can we convince parents to vaccinate acknowledge their fears  via  autism antivaxxer,1.0,1.0
4MOB7009,if you dont vaccinate your kids youre not allowed to make im so afraid of ebola and all its scariness comments because youre ridiculous,1.0,1.0
1258AMHH, also parents who refuse to keep their kids alive by vaccinating them bc he they think itll make them autistic,1.0,1.0
32GR9QFA, our yrold son has autism and i would amp did absolutely have him vaccinatedhis life is worth being healthy for,1.0,1.0
ZN1X92KQ, i was born before mmr existed i got each of the vaccination separately as a child,0.0,0.6666666666666666
NH36I2LY,okay episode over remember vaccinate your kids dont be dumb itll save you a lot of possible true down the road,1.0,1.0
Q5UYM4QL,immediatecare qualityoflife strawberries boost immunity 🍓 promote eye health 🍓 cancer prevention… ,0.0,1.0
NKI9GIT7,“ original article intussusception risk after rotavirus vaccination in us infants ,-1.0,0.6666666666666666
LAPH9Z0X,i already miss the measles outbreak,0.0,1.0
1JKXZ0V5,🍍🍊🌽🍈lt  these yellow and oranges contain beta carotene  which helps promotes healthy visionimmunityamp reduce risks of cancers,0.0,1.0
JIOJOQUK,austin doctors are warning parents to vaccinate against the measles ,1.0,0.6666666666666666
VFF10J6B,"
there is no such thing as a safe vaccine and there will never be",-1.0,1.0
ZAGCC4QR,please vaccinateyourkids conserving heard immunity is critical a measles outbreak in this day and age is ridiculous,1.0,1.0
04SJ8C44,dr mary mora speaking at the immunization press conference getvaccinated  ingham county health… ,1.0,0.6666666666666666
016KGCQ8, measles and the flu are much more communicable than ebola the reason it spreads so quickly in africa is because a lot of burial,0.0,0.6666666666666666
27WM95S4,the irony is even if vaccines gave kids autism they dont theyd still more better contributors to society than their dumb ass parents,1.0,1.0
WKAEL9SG,my son has been vaccinated at least  times but has no immunity to measles it is rare but please get vaccinated,1.0,1.0
G4DSMFUN,we were gonna do  but i dont really want measles so suffering through a day with chucky… ,0.0,1.0
LBWLODSY, q vaccines in your opinion safe or unsafe and why pschat parents this should not be a question vaccinate your kids,1.0,1.0
WYVXGLXC,this is what happens when babies arent vacinated vacinate measles ,1.0,1.0
GLLHQ3D2,"vaccine know your rights and risks

thirty forty vaccinations before elementary school ends if true notgood 🖖🏻 ",-1.0,0.6666666666666666
XMXIOECV,nd best benefit to immunizations after not getting horrible disease grayson out quick amp early for bed tonight,1.0,0.6666666666666666
DKS73TZJ,"how do you feel about parents who dont vaccinate their kids

measlesoutbreak",0.0,0.6666666666666666
GKH8TCVD,look at how serious the news is taking the disease it can be deadly vaccinate vaccineswork,1.0,0.6666666666666666
HCBVO71B,healthcare workers with measles continued to work no sick days pto idweek,0.0,1.0
VVAUZNW3,a ssybaby immunizations,0.0,0.6666666666666666
S6UKR4OJ,psa vaccinate your fucking kids,1.0,1.0
DBFVYMVF,worst tweet “ how do vaccines protect babies discover the answers on vaccinesnova on   on pbs ,1.0,0.6666666666666666
M6TOPE25," cases of measles in us 
vacccinateyourkids",0.0,0.6666666666666666
I5E5U0WY,doctors recommend hpv vaccine as early as age  human papilloma virusa sexually transmitted diseasecan be ,0.0,0.6666666666666666
OSZCEW89,federal court has vindicated snowden as a whistleblower tell  he deserves immunity  via ,0.0,1.0
RZINES6F,fake drugs “ natural news hpv vaccines gardasil becomes a market dud in wake of informed backlash  mmot”,-1.0,0.6666666666666666
ZT88PN6Y, i can understand your anger you cant damn a safe process because of a rare edge case vaccines save lives,1.0,1.0
TCO9WK8R,please get vaccinated amp vaccinate your children for measles i almost died at  weeks of age from measles contracted from a  yr old cousin,1.0,1.0
9E2SFMFL,health science center provides vaccines to students in need students must be up to date on their immunizations ,1.0,0.6666666666666666
IT9GHIP5,measles alert for dulles travelers the loudoun county health department is warning people who were at dulles ,0.0,1.0
WJRJEZJI,german measles officially eliminated in north south america health officials say the first region of the world to… ,1.0,1.0
F9FF0L0Z,“ dr nancy snyderman comments on measles outbreak on  i want parents to be a little afraid” there is no exvuse,1.0,1.0
LC0ZQBPA,aids   in children carry immunity to aids  study ,0.0,0.6666666666666666
8A14EIH4,only reason why i wouldnt go to disneyland is cause i dont wanna get measles and i wouldnt have anyone to go with 😒,0.0,1.0
RRJ8MMCO,flu vaccine may soon be required for up to kids in nyc details up next on ,0.0,0.6666666666666666
JGSFIGCM,“ bart says anyone who rode bart in the east bay last week should see dr if any symptoms of measles rash fever cough” ,0.0,0.6666666666666666
3QJ6UU9P,hb new health immunizations exemptions from immunization requirements expand statements of exemption to  ,1.0,0.6666666666666666
SBT9DPA2, there is no legitimate research connecting vaccine to autism its a dangerous accusation because it can endanger a childs life,1.0,0.6666666666666666
T6YLJCHK,vaccines do not cause autism yesonsb vaccineswork,1.0,1.0
ZAS1UAX1,taking it to outer space tonight madhatter mmr dc dj live photoshop flyer connecticutave… ,0.0,1.0
K2YXFSSY, duh child vaccines required adults are not come with some real info,1.0,1.0
TFNTLZ33,whats worse not getting measles shot or going to the hospital on thewalkingdead,0.0,0.6666666666666666
3NFF69L4,  para nada majo que desde que te he comenzado a seguir  no es masterchef sin tus tuits mmr,0.0,1.0
J3VTEHQF, yeah vaccines are bullshit all they are is mandatory and legal poison ,-1.0,0.6666666666666666
LQOXR0WT,mt  measles has affected some states more than others and rules for vaccinating vary  ,0.0,0.6666666666666666
I32Z82IG,obama imported ebola and measles while at the same time giving iran the nuclear option hmmm,0.0,1.0
6RG3NJ2V,disneylands measles just made the news here in nc,0.0,1.0
D7MDUA2E,ive revised my measles position dont make it illegal not to vaccinate make it illegal to bring your unvaccinated kids in public,1.0,0.6666666666666666
QFRA4MOE,months physical and vaccines   kids amp teens medical group ,1.0,1.0
E67OAXRC,health department issues statewide measles alert north texas  – state health officials ,0.0,1.0
TVMT8YLL,nothing makes me more enraged than people who refuse to vaccinate their kids out of a made up fear that it causes autism getfucked idiots,1.0,1.0
TOGQ04TS,taking the baby to her  month dr appt for vaccinations  shell nrh ,1.0,1.0
5NUQRZOC, idk i always thought it was a requirement to be fully vaccinated to even go to school epidemic or not,0.0,0.6666666666666666
CYET894Y,up to  syrian infants die from faulty measles batch  via ,0.0,0.6666666666666666
JP21A8RB,"nationalism is an infantile thing it is the measles of mankind

albert einstein",0.0,1.0
XU6H8O6G,missing vaccines leads to missing school for kids in many districts by kendall downingindianapolis ind – ,0.0,0.6666666666666666
97WS7DJH,amid measles outbreak one crucial group not required to vaccinate while much of the attention in the ongoing… ,0.0,0.6666666666666666
B8FZEJKO,if you shopped at the gilroy costco jan pm you may have been exposed to measles ktvu ,0.0,1.0
8RMMXRBT,"use to be now they got measles😷😷😷

 disney used to be a scary place ",0.0,0.6666666666666666
3QNEVLQS,  and the truth always have been told toget the flu vaccine this year i didnt get it,-1.0,0.6666666666666666
N9M0S722,weird i thought ben carson conservative just said all kids should be vaccinated sigh ,1.0,0.6666666666666666
2Q4U4PDE,american medical association endorses ending nonmedical exemptions for vaccinations ,0.0,0.6666666666666666
68SGYYBE, that maybe you shouldnt give those babies vaccines until they are more developed ya think,-1.0,0.6666666666666666
I2Y8VFJJ,the way god intended california parents are having measles parties instead of vaccinating their kids  via ,1.0,0.6666666666666666
U1KBDTPS,to the parent of an unvaccinated child who exposed my atrisk kids to measles  via ,1.0,0.6666666666666666
VOB830JI,andwereback threebestfriends mmr myladies prettygirls sundaynight itsbeenwaytoolong myloves 💕… ,0.0,1.0
FA489FHV,you should be taken out behind a shed and shot if you dont get your kids vaccinated,1.0,1.0
EMYYS0N5, theyd also rather reduce herd immunity and have others children die than risk their own child being autistic dolts,1.0,1.0
TCI5NXN3, yes vaccines where given to african women amp became sterile afterwardsamp provaxxer amp depopulationalist bill gates promotes it,-1.0,1.0
VWWG8DL0,"send a letter to our senate letting them know you are for sb   public health vaccinations

 ",1.0,1.0
FNY3X0VB,theres a measles outbreak in nyc do we need to get revaccinated serious question anyone know,1.0,0.6666666666666666
25X23TT5,arizona monitoring hundreds for measles linked to disneyland via ,0.0,1.0
5HY6756R, in  children are wo lifesaving vaccines pls change this amp put immunizationfirst on the  summit agenda,1.0,1.0
AILPZS7I,  the promethean enthusiasm is infectious like measles,0.0,1.0
BEGEMZGT,damn the whole motha fuckin team out tonight mmr skyboxlounge,0.0,1.0
B1IDXKRK,how many kids at a school arent immunized plano isd says it cant tell you ,0.0,0.6666666666666666
UEFDDB85,   u do know that vaccinated ppl can get the disease and spread it dont u,-1.0,1.0
A35TNI6J,vaccinate your kids for the sake of us all svu,1.0,1.0
ILX7U8AE,“ people who complain live longer releasing tension increases immunity and improves overall health”  youre immortal,0.0,1.0
4EO8JMLR, i cant my brother had an awful reaction and my friends child developed autism after her first vaccines,-1.0,1.0
42XGM3E5,come and pray in our mmr marian gardens  ,0.0,1.0
8TILY3FQ,“  hitler had measles when he was six funfact pez”,0.0,1.0
QCLJQKSO,click on this link to donate to our measles initiative all proceeds go directly to the american red cross 💉💵❤️ ,0.0,0.6666666666666666
7LUK5YPX,"
measles outbreak different states different rules on vaccinations",0.0,0.6666666666666666
HLYTI9OS, that is the differences i personally can testify to in a world pre and post childhood vaccines we dont want to go back,1.0,1.0
H3LD67D2,  its so damn selfish especially when some kids with weakened immune systems cant be vaccinated on the proper schedule,1.0,0.6666666666666666
VJKX31KJ,dirt game mmr photoshop flyer dj dc dupontcircle dollarmugnight budlight dig mixmasterrod… ,0.0,1.0
1ZWVVRE9, i want measles too,0.0,1.0
NVQ8ZO8L,when did vaccinations for school children stop becoming mandatory why would you do that vaccinate your kids seriously,1.0,1.0
02R4UB8A, tweet reactmake a wish i wish i didnt have a cold shire will reverse effect immunimmortality is truth to all in the mind,0.0,1.0
DVXZX8G0, soooo health industry  can make more money off of measles epidemics than mmr vaccine who woulda thought,1.0,0.6666666666666666
VGX26HRW,i dont have kids but ill take yours to get vaccinated if youre too busy,1.0,1.0
6X59MN9R,presenting on the importance of influenza vaccination get vaccinated protect children protect coworkers protect family protect yourself,1.0,1.0
ALV378IW,“ white house science says parents should vaccinate their kids  i hate that we even still have to clarify,1.0,1.0
N45HNE1H,“  a s” no doubt we on the same side ma,0.0,1.0
6SQPLPAL,     even with the vaccine your child is still at risk of catching the disease,0.0,0.6666666666666666
8A83J3DJ,obama says vaccinate your children  thanks obama  i had just put myst down payment on an iron lung really arrogantignorance,-1.0,0.3333333333333333
KQS5VTQG,what is the vaccination rate at your school explore the data ,1.0,0.6666666666666666
Q66DV2QC,i got vaccinated when i was a child attending public school this was in the late s early s how is this news,1.0,1.0
IH7UKJOP,not dead virusits live attenuated trial expanding “ myeloma therapy using measles virus alive and well ,0.0,1.0
NXJ65Y7G,supporting ld an act to improve childhood vaccination rates in maine vaccineswork ,1.0,1.0
FY2OB8L4,pretty cool website about the antivaccine movement keep this in mind when you start to have kids ,-1.0,0.6666666666666666
4RZWXWTM,“ bill that would require more childhood vaccinations dies   too bad,1.0,0.6666666666666666
8PEEJ4US,  vaccinations must be a requirement there are many infants who can not be vaccinated r u guys willing to risk their lifes,1.0,1.0
3CM9P1N2,plano isd barred from releasing immunization statistics despite measles threat ,0.0,1.0
9SDHC02U, thats what id heard too shows just how contagious measles is 😥,0.0,1.0
UXX4K1R1,nah rt everyone gt  months should get the flu vaccine especially ppl wchronic diseases the elderly amp the immunocompromised,1.0,0.6666666666666666
QGC3RHQY,dont get measles ,0.0,0.6666666666666666
LVJTQP6B,w i t my w o e s crewlove jennifair mmr smoknfaces somage mogulmedia nyc chicago  taj… ,0.0,1.0
XY8VQKWN,my arm is killing meeeeeee stupid typhoid vaccine,1.0,0.6666666666666666
S7IB065S,officials  measles cases confirmed in illinois six cases of measles have been confirmed in illinois including… ,0.0,1.0
QSVRKSRD, the hib vaccine alone has virtually eliminated the huge death rate in infants of bacterial meningitis all of us caring  infants,1.0,1.0
K3WJUC2E,new choices for seasonal flu vaccines webmd health newsby brenda goodman mareviewed by michael w smith ,0.0,1.0
TSOMOJ55,next stop  jerseygirlsonfridays  mmr swagg,0.0,1.0
Y5LXGP4H,"vaccination day now my babies are safe 🐴🐎💉
dia de vacinação agora meus bebês estão a… ",1.0,1.0
OOIOERYG,at this convenient care clinic clinic to get immunizations needed for nursing school and there are some real characters in here…,0.0,0.6666666666666666
53Q49VRW,childrens museum of houston to offer free vaccinations ,1.0,0.6666666666666666
BCE8E4A9,cdc measles cases in us since january the number of us measles cases this year is growing the cdc says… ,0.0,1.0
URKVQ5RF, its like asking would you rather have the chickenpox or the measles,0.0,1.0
LER88GRL,  its also not an argument vaccinations are a huge government money makernot for our well being bs based in lies,-1.0,0.6666666666666666
9ANI1IJD,  she just adopted a baby full bred german shepherd because owners didnt vaccinate he got parvo so they said,0.0,1.0
0DU92X27,fyi all you people who dont believe in vaccinations are the reason for the measles outbreak,1.0,1.0
FPKP7QLI,“ measles vaccination rates tanzania does better than us  ,1.0,0.6666666666666666
35IBZC58,we the new killer bees swarming the cipher my lyrics are hyper to find the vaccine to this emcee disease yall hiv and im magic,0.0,0.6666666666666666
JILK6OUB,"just vaccinate your kids and yourself and at least do your research before arguing


",1.0,1.0
T09Q1BZ7,   his health  science advisor on vaccines  is  need i say more really roflmao ,0.0,0.6666666666666666
0GY120L8,rt  we can prevent another measles outbreak from occurring through some simple steps  ,0.0,0.6666666666666666
IB0T965A,dont use your kids as your ante for your conspiracies rt  seems like a good time to remind everyone vaccinate your kids,1.0,0.6666666666666666
AKN06FV7,followdatbag followyourdreamsbutdontsleep my bro djhpnotiq teamfollowdatbag mmr fdbdj datbag… ,0.0,1.0
0CUJLJYB,im fudging coming down w a cold on top of all this i hope i dont get measles,0.0,1.0
LKC9N86Q,i swear yall freakin dirty elementary kids w the measles better stay home i better not see measles spread to start 😒,0.0,0.6666666666666666
XISOC4AI,fod release party  mmr thecampaign rydethawave mixtape release as well blackampgold… ,0.0,1.0
F64ZL1IK,  study published on alleged link between vaccines and autism removed pending further investigation ,0.0,0.6666666666666666
MDE7INXJ,new jersey school to offer workers hepatitis a vaccine teachers and employees at passaic high school are being… ,1.0,0.6666666666666666
IJ5CEUSC, month check up vaccines   vaccines 😢💉💉💉💉💉 my baby  batta pediatric clinic ,1.0,0.6666666666666666
OQ5A006X,measles schmeasles you cant stop us  disneyland ,0.0,1.0
K6A6UUEE,measles people are getting measles in disney land gut instinct is to blame antivaxxers but let me research this a bit first,0.0,0.6666666666666666
PVHX3E4I,mckinney offers free immunizations for uninsured children no appointment is necessary but bring a copy of the ,1.0,0.6666666666666666
EH6LZXL3,"at this point yall better know its spirit week which means i get immunity from weird looks when i show up at school in full xosume ok
ok",0.0,1.0
5GLNLXNT,jennifair behind the scene footage mmr mixtape brooklyn chicago ,0.0,1.0
XFHW00IA, why is it fair for antivax taxpayers be denied enrollment tax support schools amp the vaccine injury compensation program,-1.0,0.6666666666666666
FFJQ2Q4N, so the expenditure of money is comparable to a capital crime doesnt rfk jr have some vaccine lies to spread or something,-1.0,0.3333333333333333
CXITWF17,measles outbreak on both coasts thanks to science deniers refusing to vaccinate their children states need to stop stupid ppl from this,1.0,0.6666666666666666
2UHI3UXH,childrens museum of houston to offer free vaccinations ,1.0,0.6666666666666666
V81EJS9G,kids cant bring pb crackers to school but ok to bring measles “ in allows optouts for vaccinations ,1.0,1.0
WJBE3IYL,    thanks to dr offit for an enlighting talk about measles outbreak at the nj aap conference,0.0,1.0
RFAU606S,you tell them  vaccines do not cause autism kellyfile donthatevaccinate knowledgeispower vaccineswork measlesoutbreak,1.0,0.6666666666666666
9ZUS4F1Q, servings of measles please “ youre cleared to descend to pilots grill for a plane great burger ,0.0,1.0
517OP4VW,measles cases atyear high because parents are failing to get children vaccinated ,1.0,0.6666666666666666
8KBWNNET,vaccinate your kids plz thx “ a case of whooping cough has been reported at carmel high school ,1.0,1.0
XK6TBOB7,i hate you measles  signed everyone,0.0,1.0
LSW9QKJA,  ceo says measles outbreak not hurting attendance  ,0.0,1.0
WFXC2FQM,   does current measles outbreak have roots in reckless congressional oversight,0.0,1.0
KBA9722B,     this is the measles r for general population ,0.0,1.0
47ML6NVS,measles exposure warning sign at  dont  we vaccinate for that ,1.0,0.6666666666666666
CJPNXU1U,i know people who dont want to vaccinate themselvesbaby and im like babies get whooping cough straight from the mother amp its fatal,1.0,1.0
MM43VXMI,some disney employees test positive for measles theme park confirms ,0.0,1.0
